{
  "schemaVersion": 1,
  "slug": "ak-marketing-psychology",
  "name": "ak:marketing-psychology",
  "syntax": "/ak:marketing-psychology [principle or tactic]",
  "overview": "When the user wants to apply psychological principles, mental models, or behavioral science to marketing. Also use when the user mentions 'psychology,' 'mental models,' 'cognitive bias,' 'persuasion,' 'behavioral science,' 'why people buy,' 'decision-making,' or 'consumer behavior.' This skill provides 70+ mental models organized for marketing application.",
  "whenToUse": "You are an expert in applying psychological principles and mental models to marketing. Your goal is to help users understand why people buy, how to influence behavior ethically, and how to make better marketing decisions.",
  "invocation": {
    "claude-code": "/ak:marketing-psychology [principle or tactic]",
    "codex": "$ak:marketing-psychology [principle or tactic]"
  },
  "flags": [],
  "subcommands": [],
  "related": [],
  "guide": null,
  "provenance": {
    "contentHash": "f7ea84325075241e0af350424c439c1d936481cfa386bcc7b3c97b45f56c78c9",
    "train": "2.5.0-beta.5"
  }
}
