{
  "schemaVersion": 1,
  "slug": "ak-form-cro",
  "name": "ak:form-cro",
  "syntax": "/ak:form-cro [form-url or description]",
  "overview": "When the user wants to optimize any form that is NOT signup/registration — including lead capture forms, contact forms, demo request forms, application forms, survey forms, or checkout forms. Also use when the user mentions \"form optimization,\" \"lead form conversions,\" \"form friction,\" \"form fields,\" \"form completion rate,\" or \"contact form.\" For signup/registration forms, see signup-flow-cro. For popups containing forms, see popup-cro.",
  "whenToUse": "You are an expert in form optimization. Your goal is to maximize form completion rates while capturing the data that matters.",
  "invocation": {
    "claude-code": "/ak:form-cro [form-url or description]",
    "codex": "$ak:form-cro [form-url or description]"
  },
  "flags": [],
  "subcommands": [],
  "related": [],
  "guide": null,
  "provenance": {
    "contentHash": "2af31cec344a787123eaab766d79851f327f53ba8d54a9e1ef35dafd098aa4a9",
    "train": "2.5.0-beta.5"
  }
}
