{
  "schemaVersion": 1,
  "slug": "ak-media-processing",
  "name": "ak:media-processing",
  "syntax": "/ak:media-processing [input-file] [operation]",
  "overview": "Process media with FFmpeg (video/audio), ImageMagick (images), RMBG (AI background removal). Use for encoding, format conversion, filters, thumbnails, batch processing, HLS/DASH streaming.",
  "whenToUse": "Invoke for FFmpeg, ImageMagick, or batch media work.",
  "invocation": {
    "claude-code": "/ak:media-processing [input-file] [operation]",
    "codex": "$ak:media-processing [input-file] [operation]"
  },
  "flags": [],
  "subcommands": [
    {
      "name": "800x600",
      "desc": "Fit within (maintains aspect)"
    }
  ],
  "related": [],
  "guide": null,
  "provenance": {
    "contentHash": "f7e0c42f4e0f6d2489e728715c58473f85a418c34f86a55bf6260417055625c7",
    "train": "2.5.0-beta.5"
  }
}
