{
  "schemaVersion": 1,
  "slug": "ak-ckm-storage",
  "name": "ak:storage",
  "syntax": "/ak:storage [list|sync|upload|url] [args]",
  "overview": "S3 storage operations - upload, sync, list, get URLs",
  "whenToUse": "| Subcommand | Description | Reference | |------------|-------------|-----------| | `list` | list | `references/list.md` | | `sync` | sync | `references/sync.md` | | `upload` | upload | `references/upload.md` | | `url` | url | `references/url.md` |",
  "invocation": {
    "claude-code": "/ak:storage [list|sync|upload|url] [args]",
    "codex": "$ak:storage [list|sync|upload|url] [args]"
  },
  "flags": [],
  "subcommands": [
    {
      "name": "list",
      "desc": ""
    },
    {
      "name": "sync",
      "desc": ""
    },
    {
      "name": "upload",
      "desc": ""
    }
  ],
  "related": [],
  "guide": null,
  "provenance": {
    "contentHash": "2f61752f753b37187a74c783ad3049c139240394b315596e485b226d7983e3db",
    "train": "2.5.0-beta.5"
  }
}
