{
  "schemaVersion": 1,
  "slug": "ak-plan",
  "name": "ak:plan",
  "syntax": "/ak:plan [task] [--fast|--hard|--deep|--parallel|--two] [--tdd|--no-tasks] [--html] [--github] [--wiki] OR [archive|red-team|validate]",
  "overview": "Plan implementations, design architectures, create technical roadmaps with detailed phases. Use for feature planning, system design, solution architecture, implementation strategy, phase documentation, editorial self-contained HTML plan artifacts with --html, and AgentWiki publishing with --wiki.",
  "whenToUse": "Invoke when work needs phases, architecture, or a roadmap.",
  "invocation": {
    "claude-code": "/ak:plan [task] [--fast|--hard|--deep|--parallel|--two] [--tdd|--no-tasks] [--html] [--github] [--wiki] OR [archive|red-team|validate]",
    "codex": "$ak:plan [task] [--fast|--hard|--deep|--parallel|--two] [--tdd|--no-tasks] [--html] [--github] [--wiki] OR [archive|red-team|validate]"
  },
  "flags": [
    {
      "name": "--fast",
      "desc": ""
    },
    {
      "name": "--hard",
      "desc": ""
    },
    {
      "name": "--deep",
      "desc": ""
    },
    {
      "name": "--parallel",
      "desc": ""
    },
    {
      "name": "--two",
      "desc": "Two approaches"
    },
    {
      "name": "--tdd",
      "desc": "Add tests-first structure to each phase for regression-safe refactors"
    },
    {
      "name": "--no-tasks",
      "desc": "Skip task hydration"
    },
    {
      "name": "--html",
      "desc": "Output a self-contained editorial interactive HTML plan with visible phase outlines, markdown detail modals, and optional generated watercolor technical sketch imagery"
    },
    {
      "name": "--github",
      "desc": "Create or update a GitHub issue after plan validation with branch, summary, plan links, open questions, and ready to review"
    },
    {
      "name": "--wiki",
      "desc": "Publish the final reviewed plan docs or HTML artifact to AgentWiki via CLI or MCP when available"
    }
  ],
  "subcommands": [
    {
      "name": "archive",
      "desc": "Write journal entry & archive plans"
    },
    {
      "name": "red-team",
      "desc": "Adversarial plan review"
    },
    {
      "name": "validate",
      "desc": "Critical questions interview"
    }
  ],
  "related": [
    "ak-frontend-design",
    "ak-ui-ux-pro-max",
    "ak-cook",
    "ak-journal",
    "ak-project-organization",
    "ak-brainstorm",
    "ak-scout"
  ],
  "guide": "core-loop",
  "provenance": {
    "contentHash": "5d1b868c3529eb51deab3715737200d293b7b76cf42da91f205a65ec166f62e2",
    "train": "2.5.0-beta.5"
  }
}
