{
  "schemaVersion": 1,
  "slug": "ak-storage",
  "name": "ak:storage",
  "syntax": "/ak:storage",
  "overview": "S3-compatible object storage integration for marketing assets. Works with Cloudflare R2, AWS S3, MinIO, Backblaze B2, DigitalOcean Spaces.",
  "whenToUse": "Use when s3-compatible object storage integration for marketing assets. Works with Cloudflare R2, AWS S3, MinIO, Backblaze B2, DigitalOcean Spaces.",
  "invocation": {
    "claude-code": "/ak:storage",
    "codex": "$ak:storage"
  },
  "flags": [],
  "subcommands": [],
  "related": [],
  "guide": null,
  "provenance": {
    "contentHash": "b5dc9e4343f89fcb569f32f5dd66e833ecbc6f79d8b193f74cddb162ddd3a32c",
    "train": "2.5.0-beta.5"
  }
}
