{
  "schemaVersion": 1,
  "slug": "ak-remotion",
  "name": "ak:remotion",
  "syntax": "/ak:remotion [video or component]",
  "overview": "Build video content with Remotion in React. Use for programmatic video creation, animated sequences, data-driven video rendering.",
  "whenToUse": "Invoke for programmatic video generation with React.",
  "invocation": {
    "claude-code": "/ak:remotion [video or component]",
    "codex": "$ak:remotion [video or component]"
  },
  "flags": [],
  "subcommands": [],
  "related": [],
  "guide": null,
  "provenance": {
    "contentHash": "e032bc593e3554eb67c8615bd0500ca2e246d93104828b1e0f6cff65712c69a0",
    "train": "2.5.0-beta.5"
  }
}
