{
  "schemaVersion": 1,
  "slug": "ak-react-best-practices",
  "name": "ak:react-best-practices",
  "syntax": "/ak:react-best-practices [component or pattern]",
  "overview": "Apply React and Next.js performance optimization patterns from Vercel Engineering. Use for component optimization, rendering performance, bundle analysis.",
  "whenToUse": "Invoke for React/Next.js performance and rendering issues.",
  "invocation": {
    "claude-code": "/ak:react-best-practices [component or pattern]",
    "codex": "$ak:react-best-practices [component or pattern]"
  },
  "flags": [],
  "subcommands": [
    {
      "name": "async-defer-await",
      "desc": "Move await into branches where actually used"
    },
    {
      "name": "async-parallel",
      "desc": "Use Promise.all() for independent operations"
    },
    {
      "name": "async-dependencies",
      "desc": "Use better-all for partial dependencies"
    },
    {
      "name": "async-api-routes",
      "desc": "Start promises early, await late in API routes"
    },
    {
      "name": "async-suspense-boundaries",
      "desc": "Use Suspense to stream content"
    },
    {
      "name": "bundle-barrel-imports",
      "desc": "Import directly, avoid barrel files"
    },
    {
      "name": "bundle-dynamic-imports",
      "desc": "Use next/dynamic for heavy components"
    },
    {
      "name": "bundle-defer-third-party",
      "desc": "Load analytics/logging after hydration"
    },
    {
      "name": "bundle-conditional",
      "desc": "Load modules only when feature is activated"
    },
    {
      "name": "bundle-preload",
      "desc": "Preload on hover/focus for perceived speed"
    },
    {
      "name": "server-cache-react",
      "desc": "Use React.cache() for per-request deduplication"
    },
    {
      "name": "server-cache-lru",
      "desc": "Use LRU cache for cross-request caching"
    },
    {
      "name": "server-serialization",
      "desc": "Minimize data passed to client components"
    },
    {
      "name": "server-parallel-fetching",
      "desc": "Restructure components to parallelize fetches"
    },
    {
      "name": "server-after-nonblocking",
      "desc": "Use after() for non-blocking operations"
    },
    {
      "name": "client-swr-dedup",
      "desc": "Use SWR for automatic request deduplication"
    },
    {
      "name": "client-event-listeners",
      "desc": "Deduplicate global event listeners"
    },
    {
      "name": "rerender-defer-reads",
      "desc": "Don't subscribe to state only used in callbacks"
    },
    {
      "name": "rerender-memo",
      "desc": "Extract expensive work into memoized components"
    },
    {
      "name": "rerender-dependencies",
      "desc": "Use primitive dependencies in effects"
    },
    {
      "name": "rerender-derived-state",
      "desc": "Subscribe to derived booleans, not raw values"
    },
    {
      "name": "rerender-functional-setstate",
      "desc": "Use functional setState for stable callbacks"
    },
    {
      "name": "rerender-lazy-state-init",
      "desc": "Pass function to useState for expensive values"
    },
    {
      "name": "rerender-transitions",
      "desc": "Use startTransition for non-urgent updates"
    },
    {
      "name": "rendering-animate-svg-wrapper",
      "desc": "Animate div wrapper, not SVG element"
    },
    {
      "name": "rendering-content-visibility",
      "desc": "Use content-visibility for long lists"
    },
    {
      "name": "rendering-hoist-jsx",
      "desc": "Extract static JSX outside components"
    },
    {
      "name": "rendering-svg-precision",
      "desc": "Reduce SVG coordinate precision"
    },
    {
      "name": "rendering-hydration-no-flicker",
      "desc": "Use inline script for client-only data"
    },
    {
      "name": "rendering-activity",
      "desc": "Use Activity component for show/hide"
    },
    {
      "name": "rendering-conditional-render",
      "desc": "Use ternary, not && for conditionals"
    },
    {
      "name": "js-batch-dom-css",
      "desc": "Group CSS changes via classes or cssText"
    },
    {
      "name": "js-index-maps",
      "desc": "Build Map for repeated lookups"
    },
    {
      "name": "js-cache-property-access",
      "desc": "Cache object properties in loops"
    },
    {
      "name": "js-cache-function-results",
      "desc": "Cache function results in module-level Map"
    },
    {
      "name": "js-cache-storage",
      "desc": "Cache localStorage/sessionStorage reads"
    },
    {
      "name": "js-combine-iterations",
      "desc": "Combine multiple filter/map into one loop"
    },
    {
      "name": "js-length-check-first",
      "desc": "Check array length before expensive comparison"
    },
    {
      "name": "js-early-exit",
      "desc": "Return early from functions"
    },
    {
      "name": "js-hoist-regexp",
      "desc": "Hoist RegExp creation outside loops"
    },
    {
      "name": "js-min-max-loop",
      "desc": "Use loop for min/max instead of sort"
    },
    {
      "name": "js-set-map-lookups",
      "desc": "Use Set/Map for O(1) lookups"
    },
    {
      "name": "js-tosorted-immutable",
      "desc": "Use toSorted() for immutability"
    },
    {
      "name": "advanced-event-handler-refs",
      "desc": "Store event handlers in refs"
    },
    {
      "name": "advanced-use-latest",
      "desc": "useLatest for stable callback refs"
    }
  ],
  "related": [],
  "guide": null,
  "provenance": {
    "contentHash": "d4df1ed1a220722ca2f31ed07582110ee679b29b49655f1d83ff324bcfdf030d",
    "train": "2.5.0-beta.5"
  }
}
