{
  "schemaVersion": 1,
  "slug": "ak-competitor",
  "name": "ak:competitor",
  "syntax": "/ak:competitor [analyze|content|seo|alternatives|list] [url or competitor]",
  "overview": "Competitive analysis, alternative pages, vs comparisons, SEO competitor content, market positioning, and battlecard generation.",
  "whenToUse": "Competitive analysis and competitor comparison content creation.",
  "invocation": {
    "claude-code": "/ak:competitor [analyze|content|seo|alternatives|list] [url or competitor]",
    "codex": "$ak:competitor [analyze|content|seo|alternatives|list] [url or competitor]"
  },
  "flags": [],
  "subcommands": [
    {
      "name": "analyze",
      "desc": ""
    },
    {
      "name": "content",
      "desc": ""
    },
    {
      "name": "seo",
      "desc": "SEO comparison"
    },
    {
      "name": "alternatives",
      "desc": "Create competitor comparison & alternative pages"
    },
    {
      "name": "list",
      "desc": "List tracked competitors"
    }
  ],
  "related": [],
  "guide": null,
  "provenance": {
    "contentHash": "49f6a019fc6dfd635d592e884c01007e97291cbfba640d530fbaaef8999fd3d8",
    "train": "2.5.0-beta.5"
  }
}
