{
  "schemaVersion": 1,
  "slug": "ak-persona",
  "name": "ak:persona",
  "syntax": "/ak:persona [action]",
  "overview": "💡💡 Customer persona management",
  "whenToUse": "Create and manage customer personas.",
  "invocation": {
    "claude-code": "/ak:persona [action]",
    "codex": "$ak:persona [action]"
  },
  "flags": [],
  "subcommands": [
    {
      "name": "create",
      "desc": "Create new persona"
    },
    {
      "name": "analyze",
      "desc": "Analyze audience data"
    },
    {
      "name": "list",
      "desc": "List all personas"
    },
    {
      "name": "lead-qualifier",
      "desc": "Audience analysis"
    },
    {
      "name": "researcher",
      "desc": "Market research"
    },
    {
      "name": "content-marketing",
      "desc": "Persona frameworks"
    },
    {
      "name": "assets-organizing",
      "desc": "Standardized output paths"
    }
  ],
  "related": [],
  "guide": null,
  "provenance": {
    "contentHash": "1730829cec6f644cb74fbe24d3d8395dd0c6ed353d791e9133786fad34d38089",
    "train": "2.5.0-beta.5"
  }
}
