{
  "schemaVersion": 1,
  "slug": "ak-coding-level",
  "name": "ak:coding-level",
  "syntax": "/ak:coding-level [0-5]",
  "overview": "Set coding experience level for tailored output. Use for adjusting explanation depth, code complexity, and response format to user expertise.",
  "whenToUse": "Invoke when response depth should match user expertise.",
  "invocation": {
    "claude-code": "/ak:coding-level [0-5]",
    "codex": "$ak:coding-level [0-5]"
  },
  "flags": [],
  "subcommands": [
    {
      "name": "coding-level-0-eli5",
      "desc": "`coding-level-1-junior`"
    },
    {
      "name": "coding-level-2-mid",
      "desc": "`coding-level-3-senior`"
    },
    {
      "name": "coding-level-4-lead",
      "desc": "`coding-level-5-god`"
    }
  ],
  "related": [],
  "guide": null,
  "provenance": {
    "contentHash": "280d2555e072cb41f85e12d34ea0843ac44b229ab0c29c559a867be9df948edf",
    "train": "2.5.0-beta.5"
  }
}
