{
  "schemaVersion": 1,
  "slug": "ak-init",
  "name": "ak:init",
  "syntax": "/ak:init [prompt]",
  "overview": "💡💡💡💡 Initialize marketing project — discover or establish project context, brand constraints, marketing direction, and setup. Use when starting a new marketing project or onboarding an existing one.",
  "whenToUse": "Initialize a new marketing project by gathering comprehensive client information through an agency-style marketing brief interview.",
  "invocation": {
    "claude-code": "/ak:init [prompt]",
    "codex": "$ak:init [prompt]"
  },
  "flags": [],
  "subcommands": [
    {
      "name": "docs-manager",
      "desc": "Documentation generation"
    },
    {
      "name": "research",
      "desc": "Quick evaluation of project situation"
    },
    {
      "name": "chrome-devtools",
      "desc": "Website extraction"
    },
    {
      "name": "ai-multimodal",
      "desc": "Video/image analysis"
    },
    {
      "name": "assets-organizing",
      "desc": "Standardized output paths and naming conventions"
    }
  ],
  "related": [],
  "guide": null,
  "provenance": {
    "contentHash": "7c7f064da00ab50fd9814ae49b8eb0bc981471e8b463f26c884621e7e766468e",
    "train": "2.5.0-beta.5"
  }
}
