{
  "schemaVersion": 1,
  "slug": "ak-mintlify",
  "name": "ak:mintlify",
  "syntax": "/ak:mintlify [task] [path]",
  "overview": "Build and maintain Mintlify documentation sites. Covers docs.json, MDX components, navigation, page frontmatter, theming, OpenAPI/AsyncAPI, AI docs assets such as llms.txt and skill.md, deployment targets, and local validation CLI commands.",
  "whenToUse": "Invoke for Mintlify docs site structure, MDX, or local checks.",
  "invocation": {
    "claude-code": "/ak:mintlify [task] [path]",
    "codex": "$ak:mintlify [task] [path]"
  },
  "flags": [],
  "subcommands": [],
  "related": [],
  "guide": null,
  "provenance": {
    "contentHash": "bc0bb391f0c3b52ee622e86d104e5a4354369b5ea4428c3b538e46919fb6bafc",
    "train": "2.5.0-beta.5"
  }
}
