{
  "schemaVersion": 1,
  "slug": "ak-devops",
  "name": "ak:devops",
  "syntax": "/ak:devops [platform] [task]",
  "overview": "Deploy to Cloudflare (Workers, R2, D1), Docker, GCP (Cloud Run, GKE), Kubernetes (kubectl, Helm). Use for serverless, containers, CI/CD, GitOps, security audit.",
  "whenToUse": "Invoke for cloud, containers, Kubernetes, CI/CD, or GitOps.",
  "invocation": {
    "claude-code": "/ak:devops [platform] [task]",
    "codex": "$ak:devops [platform] [task]"
  },
  "flags": [],
  "subcommands": [],
  "related": [],
  "guide": null,
  "provenance": {
    "contentHash": "2a6453480f51135fc5e910319ba4fe41ac6e9d328926159a4373abec5e0c91d4",
    "train": "2.5.0-beta.5"
  }
}
