{
  "schemaVersion": 1,
  "slug": "ak-agentize",
  "name": "ak:agentize",
  "syntax": "/ak:agentize [feature-or-module] [--both|--mcp|--cli] [--auto|--ask]",
  "overview": "Convert a codebase, feature, or module into an AI-agent-friendly CLI and/or MCP server. Covers npm packaging, stdio/SSE/Streamable HTTP surfaces, credential resolution, docs, tests, CI, and a companion Claude skill for users who need an existing capability exposed as a reusable agent tool.",
  "whenToUse": "Invoke to expose existing code as a reusable CLI or MCP tool.",
  "invocation": {
    "claude-code": "/ak:agentize [feature-or-module] [--both|--mcp|--cli] [--auto|--ask]",
    "codex": "$ak:agentize [feature-or-module] [--both|--mcp|--cli] [--auto|--ask]"
  },
  "flags": [
    {
      "name": "--both",
      "desc": ""
    },
    {
      "name": "--mcp",
      "desc": "MCP server only"
    },
    {
      "name": "--cli",
      "desc": "CLI only"
    },
    {
      "name": "--auto",
      "desc": "- Choose `--both` unless a clear signal says otherwise (e.g., browser-only code → skip CLI; no side-effect-free ops → skip MCP)."
    },
    {
      "name": "--ask",
      "desc": "after analysis, challenge the user with clarifying questions before implementing"
    },
    {
      "name": "--version",
      "desc": "`--json` for machine-readable output on every command"
    }
  ],
  "subcommands": [],
  "related": [
    "ak-mcp-builder",
    "ak-project-management",
    "ak-scout",
    "ak-test",
    "ak-docs",
    "ak-skill-creator",
    "ak-cook"
  ],
  "guide": null,
  "provenance": {
    "contentHash": "1019f7deede871b275f9bcbf1cda5fd5e7f44076a211eee42fb6c4bd2219fb36",
    "train": "2.5.0-beta.5"
  }
}
