{
  "schemaVersion": 1,
  "slug": "ak-graphify",
  "name": "ak:graphify",
  "syntax": "/ak:graphify [path] [--mcp|--report|--watch]",
  "overview": "Build queryable knowledge graphs from code, docs, papers, and images. Use for codebase understanding, architecture analysis, cross-file relationship discovery, token-efficient navigation.",
  "whenToUse": "Invoke to turn code or docs into a queryable graph.",
  "invocation": {
    "claude-code": "/ak:graphify [path] [--mcp|--report|--watch]",
    "codex": "$ak:graphify [path] [--mcp|--report|--watch]"
  },
  "flags": [
    {
      "name": "--mcp",
      "desc": ""
    },
    {
      "name": "--report",
      "desc": ""
    },
    {
      "name": "--watch",
      "desc": ""
    }
  ],
  "subcommands": [
    {
      "name": "query_graph",
      "desc": "Search for concepts and relationships"
    },
    {
      "name": "get_node",
      "desc": "Get details of a specific node"
    },
    {
      "name": "get_neighbors",
      "desc": "Find related concepts"
    },
    {
      "name": "shortest_path",
      "desc": "Find connection path between two concepts"
    },
    {
      "name": "EXTRACTED",
      "desc": "Directly from AST (imports, function calls, class inheritance)"
    },
    {
      "name": "INFERRED",
      "desc": "LLM-derived with confidence score"
    },
    {
      "name": "AMBIGUOUS",
      "desc": "Uncertain — needs human verification"
    }
  ],
  "related": [
    "ak-scout",
    "ak-plan",
    "ak-repomix",
    "ak-gkg"
  ],
  "guide": null,
  "provenance": {
    "contentHash": "a7828bd78815a8312f506b8c15135ec0ba1001d42deeeef024bdb8675a97c990",
    "train": "2.5.0-beta.5"
  }
}
