{
  "schemaVersion": 1,
  "slug": "ak-analytics",
  "name": "ak:analytics",
  "syntax": "/ak:analytics [metric or report-type]",
  "overview": "Activate for marketing analytics, KPI tracking, reporting dashboards, attribution analysis, and performance optimization. Use when analyzing campaign data, creating reports, or measuring marketing ROI.",
  "whenToUse": "Performance measurement, reporting, and data-driven optimization.",
  "invocation": {
    "claude-code": "/ak:analytics [metric or report-type]",
    "codex": "$ak:analytics [metric or report-type]"
  },
  "flags": [],
  "subcommands": [],
  "related": [],
  "guide": null,
  "provenance": {
    "contentHash": "e6a0c9597366ed411620e926f03b3a17e40f28ce2b9e545d0f49882f2efe9521",
    "train": "2.5.0-beta.5"
  }
}
