{
  "schemaVersion": 1,
  "slug": "ak-journal",
  "name": "ak:journal",
  "syntax": "/ak:journal [topic or reflection]",
  "overview": "Write chronological technical journals for session reflection and change analysis. Journals preserve work history; they do not replace current docs or ADRs.",
  "whenToUse": "Invoke for technical session reflection or chronological work records.",
  "invocation": {
    "claude-code": "/ak:journal [topic or reflection]",
    "codex": "$ak:journal [topic or reflection]"
  },
  "flags": [],
  "subcommands": [],
  "related": [
    "ak-cook",
    "ak-fix"
  ],
  "guide": "core-loop",
  "provenance": {
    "contentHash": "2efd607cc9fe8accd78d2ef45569316283e4e30dee79b3ed70b9020957e7bf19",
    "train": "2.5.0-beta.5"
  }
}
