{
  "schemaVersion": 1,
  "slug": "ak-content-marketing",
  "name": "ak:content-marketing",
  "syntax": "/ak:content-marketing [content-type] [topic]",
  "overview": "Activate for content strategy, editorial calendars, content pillar mapping, blog planning, and content audit. Use when planning content programs, creating editorial workflows, or building topic clusters.",
  "whenToUse": "Strategic content planning, editorial workflows, and content optimization frameworks.",
  "invocation": {
    "claude-code": "/ak:content-marketing [content-type] [topic]",
    "codex": "$ak:content-marketing [content-type] [topic]"
  },
  "flags": [],
  "subcommands": [],
  "related": [],
  "guide": "run-a-campaign",
  "provenance": {
    "contentHash": "dd0bf9b29e412008581eb8450308a2abece1e62bc74934fa81a2b0783e0bc3a6",
    "train": "2.5.0-beta.5"
  }
}
