{
  "schemaVersion": 1,
  "slug": "ak-cip-design",
  "name": "ak:cip-design",
  "syntax": "/ak:cip-design [deliverable or brand-element]",
  "overview": "Corporate Identity Program design with 50 deliverables, 20 styles, 20 industries. Generate CIP mockups with Gemini Nano Banana (Flash/Pro). Actions: design, create, generate brand identity. Deliverables: business card, letterhead, signage, vehicle, apparel, packaging. Styles: corporate, luxury, minimal, modern.",
  "whenToUse": "Comprehensive Corporate Identity Program (CIP) design system with 50+ deliverables, 20 design styles, 20 industry guides. Search design guidelines and generate mockups using Gemini Nano Banana (Flash/Pro) models.",
  "invocation": {
    "claude-code": "/ak:cip-design [deliverable or brand-element]",
    "codex": "$ak:cip-design [deliverable or brand-element]"
  },
  "flags": [],
  "subcommands": [
    {
      "name": "pro",
      "desc": "`gemini-3-pro-image-preview` - Quality, 4K text rendering"
    }
  ],
  "related": [],
  "guide": null,
  "provenance": {
    "contentHash": "bad70dd9c37340679bead989b12555f5ea1f9b0e1894fa615aff004156df8020",
    "train": "2.5.0-beta.5"
  }
}
