{
  "schemaVersion": 1,
  "slug": "ak-better-auth",
  "name": "ak:better-auth",
  "syntax": "/ak:better-auth [auth-method or feature]",
  "overview": "Add authentication with Better Auth (TypeScript). Use for email/password, OAuth providers (Google, GitHub), 2FA/MFA, passkeys/WebAuthn, sessions, RBAC, rate limiting.",
  "whenToUse": "Invoke for Better Auth setup, sessions, OAuth, MFA, or RBAC.",
  "invocation": {
    "claude-code": "/ak:better-auth [auth-method or feature]",
    "codex": "$ak:better-auth [auth-method or feature]"
  },
  "flags": [],
  "subcommands": [
    {
      "name": "magicLink",
      "desc": "verification tokens are single-use; avoid custom flows that mint multiple sessions from concurrent requests."
    }
  ],
  "related": [],
  "guide": null,
  "provenance": {
    "contentHash": "5171008779ed3e6044766ccc097eacac8b1950705291c6e55ad117f5d0f0ab7f",
    "train": "2.5.0-beta.5"
  }
}
