{
  "schemaVersion": 1,
  "slug": "ak-databases",
  "name": "ak:databases",
  "syntax": "/ak:databases [query or schema task]",
  "overview": "Design schemas, write queries for MongoDB and PostgreSQL. Use for database design, SQL/NoSQL queries, aggregation pipelines, indexes, migrations, replication, performance optimization, psql CLI.",
  "whenToUse": "Invoke when schema, query, migration, or index work is central.",
  "invocation": {
    "claude-code": "/ak:databases [query or schema task]",
    "codex": "$ak:databases [query or schema task]"
  },
  "flags": [],
  "subcommands": [],
  "related": [],
  "guide": null,
  "provenance": {
    "contentHash": "60934ddfbca7e24a7b0cf6eed59a45aa63c2327b541472b0712bdd40614522cd",
    "train": "2.5.0-beta.5"
  }
}
