{
  "schemaVersion": 1,
  "slug": "ak-security-scan",
  "name": "ak:security-scan",
  "syntax": "/ak:security-scan [scope] [--secrets-only] [--deps-only] [--full]",
  "overview": "Scan codebase for security vulnerabilities, hardcoded secrets, dependency issues, and OWASP patterns. Use when asked to 'security scan', 'check for secrets', 'audit security', or before major releases.",
  "whenToUse": "Invoke for secrets, dependency, and OWASP-style scans.",
  "invocation": {
    "claude-code": "/ak:security-scan [scope] [--secrets-only] [--deps-only] [--full]",
    "codex": "$ak:security-scan [scope] [--secrets-only] [--deps-only] [--full]"
  },
  "flags": [
    {
      "name": "--secrets-only",
      "desc": ""
    },
    {
      "name": "--deps-only",
      "desc": ""
    },
    {
      "name": "--full",
      "desc": ""
    }
  ],
  "subcommands": [],
  "related": [],
  "guide": null,
  "provenance": {
    "contentHash": "28fe4e829ea695bcc45699fd1dcee38c2af18bdfbe4bf97fba8ddb5b2afc6f26",
    "train": "2.5.0-beta.5"
  }
}
