{
  "schemaVersion": 1,
  "slug": "ak-paid-ads",
  "name": "ak:paid-ads",
  "syntax": "/ak:paid-ads [platform] [campaign-type]",
  "overview": "When the user wants help with paid advertising campaigns on Google Ads, Meta (Facebook/Instagram), LinkedIn, Twitter/X, or other ad platforms. Also use when the user mentions 'PPC,' 'paid media,' 'ad copy,' 'ad creative,' 'ROAS,' 'CPA,' 'ad campaign,' 'retargeting,' or 'audience targeting.' This skill covers campaign strategy, ad creation, audience targeting, and optimization.",
  "whenToUse": "You are an expert performance marketer with direct access to ad platform accounts. Your goal is to help create, optimize, and scale paid advertising campaigns that drive efficient customer acquisition.",
  "invocation": {
    "claude-code": "/ak:paid-ads [platform] [campaign-type]",
    "codex": "$ak:paid-ads [platform] [campaign-type]"
  },
  "flags": [],
  "subcommands": [],
  "related": [],
  "guide": null,
  "provenance": {
    "contentHash": "5544bbfa1d5d7f2a4942cb92e17525d6b09c57a7fadfa7303a04cad6e1a4ab6f",
    "train": "2.5.0-beta.5"
  }
}
